{
  "$schema": "https://json-schema.org/draft/2020-12/schema",
  "$id": "https://meport.dev/schemas/0.1.0/meport.schema.json",
  "title": "MePort Profile",
  "description": "Portable profile data format consumed by @meport/core. The canonical contract for profile content authored as meport.json.",
  "type": "object",
  "additionalProperties": false,
  "required": [
    "schemaVersion",
    "profile",
    "links",
    "careers",
    "projects",
    "skills",
    "contact",
    "settings",
    "meta"
  ],
  "properties": {
    "schemaVersion": {
      "type": "string",
      "pattern": "^[0-9]+\\.[0-9]+\\.[0-9]+(-[a-zA-Z0-9.-]+)?$",
      "description": "Semantic version of the meport schema this document conforms to."
    },
    "profile": { "$ref": "#/$defs/Profile" },
    "links": {
      "type": "array",
      "maxItems": 100,
      "items": { "$ref": "#/$defs/Link" }
    },
    "careers": {
      "type": "array",
      "maxItems": 50,
      "items": { "$ref": "#/$defs/Career" }
    },
    "projects": {
      "type": "array",
      "maxItems": 100,
      "items": { "$ref": "#/$defs/Project" }
    },
    "skills": {
      "type": "array",
      "maxItems": 200,
      "items": { "$ref": "#/$defs/Skill" }
    },
    "contact": { "$ref": "#/$defs/Contact" },
    "settings": { "$ref": "#/$defs/Settings" },
    "meta": { "$ref": "#/$defs/Meta" }
  },
  "$defs": {
    "LocaleTag": {
      "type": "string",
      "minLength": 2,
      "maxLength": 35,
      "pattern": "^[a-zA-Z]{2,3}(-[a-zA-Z0-9]{2,8})*$",
      "description": "BCP-47 language tag (e.g., 'en', 'ja', 'zh-Hant', 'pt-BR')."
    },
    "Iso3166Alpha2": {
      "type": "string",
      "pattern": "^[A-Z]{2}$",
      "description": "ISO 3166-1 alpha-2 country code (uppercase, two letters)."
    },
    "YearMonth": {
      "type": "string",
      "pattern": "^[0-9]{4}-(0[1-9]|1[0-2])$",
      "description": "Year-month in 'YYYY-MM' format (Gregorian calendar)."
    },
    "IsoDateTime": {
      "type": "string",
      "format": "date-time",
      "description": "ISO 8601 date-time (e.g., 2026-05-11T12:34:56Z)."
    },
    "Url": {
      "type": "string",
      "format": "uri",
      "maxLength": 2048
    },
    "Email": {
      "type": "string",
      "format": "email",
      "maxLength": 254
    },
    "Slug": {
      "type": "string",
      "minLength": 1,
      "maxLength": 64,
      "pattern": "^[a-z0-9][a-z0-9-]*$",
      "description": "URL-safe identifier (lowercase alphanumerics and hyphens, must start with alphanumeric)."
    },
    "LocalizedTitle": {
      "type": "object",
      "minProperties": 1,
      "propertyNames": {
        "type": "string",
        "pattern": "^[a-zA-Z]{2,3}(-[a-zA-Z0-9]{2,8})*$"
      },
      "additionalProperties": {
        "type": "string",
        "minLength": 1,
        "maxLength": 200
      },
      "description": "Map of BCP-47 locale tag to short title-like string (max 200 chars per value)."
    },
    "LocalizedBody": {
      "type": "object",
      "minProperties": 1,
      "propertyNames": {
        "type": "string",
        "pattern": "^[a-zA-Z]{2,3}(-[a-zA-Z0-9]{2,8})*$"
      },
      "additionalProperties": {
        "type": "string",
        "minLength": 1,
        "maxLength": 5000
      },
      "description": "Map of BCP-47 locale tag to body-length string (max 5000 chars per value)."
    },
    "LinkType": {
      "type": "string",
      "enum": [
        "website",
        "blog",
        "github",
        "gitlab",
        "linkedin",
        "x",
        "mastodon",
        "bluesky",
        "instagram",
        "youtube",
        "threads",
        "facebook",
        "email",
        "rss",
        "custom"
      ],
      "description": "Identifies the kind of link. 'custom' requires iconUrl."
    },
    "Profile": {
      "type": "object",
      "additionalProperties": true,
      "required": ["displayName"],
      "properties": {
        "displayName": { "$ref": "#/$defs/LocalizedTitle" },
        "tagline": { "$ref": "#/$defs/LocalizedTitle" },
        "bio": { "$ref": "#/$defs/LocalizedBody" },
        "avatar": { "$ref": "#/$defs/Avatar" },
        "location": { "$ref": "#/$defs/Address" }
      }
    },
    "Avatar": {
      "type": "object",
      "additionalProperties": true,
      "required": ["url"],
      "properties": {
        "url": {
          "type": "string",
          "format": "uri-reference",
          "maxLength": 2048,
          "description": "URL or path to the avatar image."
        },
        "alt": { "$ref": "#/$defs/LocalizedTitle" }
      }
    },
    "Address": {
      "type": "object",
      "additionalProperties": true,
      "properties": {
        "country": { "$ref": "#/$defs/Iso3166Alpha2" },
        "region": { "type": "string", "maxLength": 100 },
        "locality": { "$ref": "#/$defs/LocalizedTitle" },
        "display": { "$ref": "#/$defs/LocalizedTitle" }
      }
    },
    "Link": {
      "type": "object",
      "additionalProperties": false,
      "required": ["id", "type", "url"],
      "properties": {
        "id": { "$ref": "#/$defs/Slug" },
        "type": { "$ref": "#/$defs/LinkType" },
        "label": { "$ref": "#/$defs/LocalizedTitle" },
        "url": { "$ref": "#/$defs/Url" },
        "featured": { "type": "boolean" },
        "order": { "type": "integer", "minimum": 0 },
        "iconUrl": { "$ref": "#/$defs/Url" }
      },
      "allOf": [
        {
          "if": {
            "properties": { "type": { "const": "custom" } },
            "required": ["type"]
          },
          "then": { "required": ["iconUrl"] }
        }
      ]
    },
    "Career": {
      "type": "object",
      "additionalProperties": true,
      "required": ["id", "organization", "role", "startDate"],
      "properties": {
        "id": { "$ref": "#/$defs/Slug" },
        "organization": { "$ref": "#/$defs/LocalizedTitle" },
        "role": { "$ref": "#/$defs/LocalizedTitle" },
        "description": { "$ref": "#/$defs/LocalizedBody" },
        "startDate": { "$ref": "#/$defs/YearMonth" },
        "endDate": {
          "anyOf": [{ "$ref": "#/$defs/YearMonth" }, { "type": "null" }]
        },
        "isCurrent": { "type": "boolean" },
        "url": { "$ref": "#/$defs/Url" },
        "location": { "$ref": "#/$defs/Address" },
        "order": { "type": "integer", "minimum": 0 }
      }
    },
    "Project": {
      "type": "object",
      "additionalProperties": true,
      "required": ["id", "title"],
      "properties": {
        "id": { "$ref": "#/$defs/Slug" },
        "title": { "$ref": "#/$defs/LocalizedTitle" },
        "description": { "$ref": "#/$defs/LocalizedBody" },
        "url": { "$ref": "#/$defs/Url" },
        "tags": {
          "type": "array",
          "maxItems": 30,
          "items": { "type": "string", "minLength": 1, "maxLength": 50 }
        },
        "relatedCareerId": { "$ref": "#/$defs/Slug" },
        "startDate": { "$ref": "#/$defs/YearMonth" },
        "endDate": {
          "anyOf": [{ "$ref": "#/$defs/YearMonth" }, { "type": "null" }]
        },
        "highlighted": { "type": "boolean" },
        "order": { "type": "integer", "minimum": 0 }
      }
    },
    "Skill": {
      "type": "object",
      "additionalProperties": true,
      "required": ["id", "label"],
      "properties": {
        "id": { "$ref": "#/$defs/Slug" },
        "label": { "type": "string", "minLength": 1, "maxLength": 100 },
        "category": {
          "type": "string",
          "minLength": 1,
          "maxLength": 64,
          "description": "Recommended values (extensible): programming, design, business, communication, language, music, art, sports, other."
        },
        "order": { "type": "integer", "minimum": 0 }
      }
    },
    "Contact": {
      "type": "object",
      "additionalProperties": true,
      "properties": {
        "email": { "$ref": "#/$defs/Email" },
        "showEmail": { "type": "boolean", "default": false },
        "formUrl": { "$ref": "#/$defs/Url" }
      }
    },
    "Settings": {
      "type": "object",
      "additionalProperties": true,
      "required": ["defaultLocale", "availableLocales"],
      "properties": {
        "defaultLocale": { "$ref": "#/$defs/LocaleTag" },
        "fallbackLocale": { "$ref": "#/$defs/LocaleTag" },
        "availableLocales": {
          "type": "array",
          "minItems": 1,
          "maxItems": 50,
          "uniqueItems": true,
          "items": { "$ref": "#/$defs/LocaleTag" }
        },
        "theme": {
          "type": "string",
          "minLength": 1,
          "maxLength": 64,
          "description": "UI theme identifier. 'default' is the built-in theme; adapters may add more."
        },
        "showPoweredBy": {
          "type": "boolean",
          "default": true,
          "description": "Display the 'Powered by meport' attribution in the rendered profile."
        },
        "enableJsonLd": {
          "type": "boolean",
          "default": true,
          "description": "Emit Schema.org JSON-LD on the rendered profile page."
        },
        "enableApi": {
          "type": "boolean",
          "default": true,
          "description": "Expose the public read API endpoints (GET /api/profile, /api/jsonld, /api/schema, /meport.json)."
        },
        "enableAnalytics": {
          "type": "boolean",
          "default": false,
          "description": "Opt-in flag for first-party analytics. Default is false to keep meport privacy-respecting by default."
        }
      }
    },
    "Meta": {
      "type": "object",
      "additionalProperties": true,
      "required": ["contentLicense"],
      "properties": {
        "createdAt": { "$ref": "#/$defs/IsoDateTime" },
        "updatedAt": { "$ref": "#/$defs/IsoDateTime" },
        "generator": {
          "type": "string",
          "minLength": 1,
          "maxLength": 100,
          "description": "Tool that produced this document (e.g. 'MePort', 'create-meport@0.1.0')."
        },
        "contentLicense": { "$ref": "#/$defs/ContentLicense" }
      }
    },
    "ContentLicense": {
      "type": "object",
      "additionalProperties": false,
      "required": ["spdxId"],
      "properties": {
        "spdxId": {
          "type": "string",
          "minLength": 1,
          "maxLength": 64,
          "description": "SPDX identifier (e.g., 'CC-BY-4.0', 'CC0-1.0') or 'Proprietary'. No default; the profile owner must choose explicitly."
        },
        "url": { "$ref": "#/$defs/Url" },
        "attribution": {
          "type": "object",
          "additionalProperties": false,
          "properties": {
            "name": { "type": "string", "minLength": 1, "maxLength": 200 },
            "url": { "$ref": "#/$defs/Url" }
          }
        },
        "rights": {
          "type": "string",
          "minLength": 1,
          "maxLength": 1000,
          "description": "Free-form rights statement (used when spdxId='Proprietary' or for additional notices)."
        }
      }
    }
  }
}
